id,text1,text2
FR-4434_813-TRAP-DIFFERENT,"un sujet central a été absent des débats de la campagne électorale européenne : la finance, estime eric albert dans une chronique au « monde ».","la récente offensive commerciale de donald trump contre le mexique, à laquelle il a finalement renoncé, a fait s’envoler les prix de l’avocat.
le consommateur américain, qui raffole du fruit vert, risquait d’être lésé, explique laurence girard, journaliste au « monde », dans sa chronique hebdomadaire."
FR-9949_12286-TRAP-DIFFERENT,"des milliers de familles coréennes ou taïwanaises se battent pour obtenir la sortie des âmes de leurs proches, admises, sans leur accord, au sanctuaire yasukuni, symbole du militarisme nippon.","dans un rapport, publié le 8 octobre, l’institution de washington rappelle l’importance de toutes les étapes allant de la conception à la distribution d’un produit, ces chaînes de valeur qui ont contribué depuis dix ans à réduire la pauvreté dans les pays émergents."
FR-5314_2370-TRAP-DIFFERENT,"trois personnes ont été blessées et prises en charge par l’antenne chirurgicale de la base.
leur vie n’est pas en danger.","la procédure engagée à l’encontre de mahamat nouri, renforce la france dans sa position d’alliée d’idriss déby."
FR-15532_11259-TRAP-DIFFERENT,"a quelques jours du premier anniversaire du mouvement, des manifestations ont eu lieu dans plusieurs villes, dans une atmosphère parfois tendue avec les forces de l’ordre.","le club de football gallois avait refusé d’honorer un premier versement au club nantais après la disparition du joueur argentin, en janvier."
FR-9089_1689-TRAP-DIFFERENT,"une soixante de fidèles ont prié le 7 septembre.
les deux imams veulent proposer un modèle alternatif au conservatisme religieux qui, selon elles, prédomine.","« le monde » organise dans le cadre du monde festival un débat sur les risques qui planent sur l’économie mondiale.
la conférence se tiendra samedi 5 octobre 2019 de 10 heures à 11 h 30, à l’opéra bastille (studio)."
